************Welcome to Address Book System************

UC1:Ability to create a Address Book Service DB.
Solution:
	//Create a database using 'CREATE'command like:address_book_system.
	mysql> CREATE DATABASE address_book_system;
	Query OK, 1 row affected (0.17 sec)
	
	//View a all databases.
	mysql> SHOW databases;
	+---------------------+
	| Database            |
	+---------------------+
	| address_book_system |
	| information_schema  |
	| mysql               |
	| payroll_service     |
	| performance_schema  |
	| sakila              |
	| sys                 |
	| world               |
	+---------------------+
	8 rows in set (0.00 sec)

	//Use particular database using 'USE' command. 
	mysql> USE address_book_system;
	Database changed

	//View database.
	mysql> SELECT DATABASE();
	+---------------------+
	| DATABASE()          |
	+---------------------+
	| address_book_system |
	+---------------------+
	1 row in set (0.00 sec)

UC2:Create a Address Book Table with first and last names, address, city, state, zip, phone number and email as its attributes.
Solution:
	//Create a table using 'CREATE' command.
	mysql> CREATE TABLE address_book
    	-> (
    	-> id               INT unsigned NOT NULL AUTO_INCREMENT,	#Unique ID for the record.
    	-> first_name       VARCHAR(50) NOT NULL,			#First Names of Address Book.
    	-> last_name        VARCHAR(50),				#Last Names of Address Book.
    	-> address          VARCHAR(150) NOT NULL,			#Address of Address Book.
    	-> city             VARCHAR(30) NOT NULL,			#City of Address Book.
    	-> state            VARCHAR(30) NOT NULL,			#State of Address Book.
    	-> zip              INT(6) NOT NULL,				#Zip of Address Book.
    	-> phone_number     INT(13) NOT NULL,				#Phone number of Addess Book.
    	-> email            VARCHAR(50) NOT NULL,			#Email of Address Book.
    	-> PRIMARY KEY(id)						#Make id primary key.
    	-> );
	Query OK, 0 rows affected, 2 warnings (1.25 sec)

	//View the table using 'DESCRIBE'command.
	mysql> DESCRIBE address_book;
	+--------------+--------------+------+-----+---------+----------------+
	| Field        | Type         | Null | Key | Default | Extra          |
	+--------------+--------------+------+-----+---------+----------------+
	| id           | int unsigned | NO   | PRI | NULL    | auto_increment |
	| first_name   | varchar(50)  | NO   |     | NULL    |                |
	| last_name    | varchar(50)  | YES  |     | NULL    |                |
	| address      | varchar(150) | NO   |     | NULL    |                |
	| city         | varchar(30)  | NO   |     | NULL    |                |
	| state        | varchar(30)  | NO   |     | NULL    |                |
	| zip          | int          | NO   |     | NULL    |                |
	| phone_number | int          | NO   |     | NULL    |                |
	| email        | varchar(50)  | NO   |     | NULL    |                |
	+--------------+--------------+------+-----+---------+----------------+
	9 rows in set (0.03 sec)


UC3:Ability to insert new Contacts to Address Book.
Solution:
	//Insert a data into table using 'INSERT' command.
	mysql> INSERT INTO address_book(first_name, last_name, address, city , state , zip , phone_number, email) VALUES
    	-> ('Sameer','Kassar','Kailla Bhatta','Ghaziabad','Uttar Pradesh',201001,997185839,'sk3090019@gmail.com'),
    	-> ('Shakiv','Saifi','Milak','Rampur','UP',44401,97162777,'shakivali123@gmail.com'),
    	-> ('Kadir','Safi','Pakbada','Muradabad','Delhi',22392,9837344,'kadir123@gmail.com'),
    	-> ('Uwesh','Saifi','Bago Wali gali','Muzafarnagar','Delhi',66335,87647275,'uwesh123@gmail.com');
	Query OK, 4 rows affected (0.15 sec)
	Records: 4  Duplicates: 0  Warnings: 0

	//View a table in a table.
	mysql> SELECT * FROM address_book;
	+----+------------+-----------+----------------+--------------+---------------+--------+--------------+------------------------+
	| id | first_name | last_name | address        | city         | state         | zip    | phone_number | email                  |
	+----+------------+-----------+----------------+--------------+---------------+--------+--------------+------------------------+
	|  5 | Sameer     | Kassar    | Kailla Bhatta  | Ghaziabad    | Uttar Pradesh | 201001 |    997185839 | sk3090019@gmail.com    |
	|  6 | Shakiv     | Saifi     | Milak          | Rampur       | UP            |  44401 |     97162777 | shakivali123@gmail.com |
	|  7 | Kadir      | Safi      | Pakbada        | Muradabad    | Delhi         |  22392 |      9837344 | kadir123@gmail.com     |
	|  8 | Uwesh      | Saifi     | Bago Wali gali | Muzafarnagar | Delhi         |  66335 |     87647275 | uwesh123@gmail.com     |
	+----+------------+-----------+----------------+--------------+---------------+--------+--------------+------------------------+
	4 rows in set (0.00 sec)
	

UC4: Ability to edit existing contact person using their name.
Solution:
	//Edit exixting contact using there name using 'UPDATE'comand.
	mysql> UPDATE address_book set city = 'Delhi' WHERE first_name = 'Kadir';
	Query OK, 1 row affected (0.08 sec)
	Rows matched: 1  Changed: 1  Warnings: 0

	//View a data table.
	mysql> SELECT * FROM address_book;
	+----+------------+-----------+----------------+--------------+---------------+--------+--------------+------------------------+
	| id | first_name | last_name | address        | city         | state         | zip    | phone_number | email                  |
	+----+------------+-----------+----------------+--------------+---------------+--------+--------------+------------------------+
	|  5 | Sameer     | Kassar    | Kailla Bhatta  | Ghaziabad    | Uttar Pradesh | 201001 |    997185839 | sk3090019@gmail.com    |
	|  6 | Shakiv     | Saifi     | Milak          | Rampur       | UP            |  44401 |     97162777 | shakivali123@gmail.com |
	|  7 | Kadir      | Safi      | Pakbada        | Delhi        | Delhi         |  22392 |      9837344 | kadir123@gmail.com     |
	|  8 | Uwesh      | Saifi     | Bago Wali gali | Muzafarnagar | Delhi         |  66335 |     87647275 | uwesh123@gmail.com     |
	+----+------------+-----------+----------------+--------------+---------------+--------+--------------+------------------------+
	4 rows in set (0.03 sec)

UC5:Ability to delete a person using person's name.
Solution:
	//Delate a feild using person name like:Uwesh.
	mysql> DELETE FROM address_book WHERE first_name = 'Uwesh';
	Query OK, 1 row affected (0.06 sec)

	//View a data table.
	mysql> SELECT * FROM address_book;
	+----+------------+-----------+---------------+-----------+---------------+--------+--------------+------------------------+
	| id | first_name | last_name | address       | city      | state         | zip    | phone_number | email                  |
	+----+------------+-----------+---------------+-----------+---------------+--------+--------------+------------------------+
	|  5 | Sameer     | Kassar    | Kailla Bhatta | Ghaziabad | Uttar Pradesh | 201001 |    997185839 | sk3090019@gmail.com    |
	|  6 | Shakiv     | Saifi     | Milak         | Rampur    | UP            |  44401 |     97162777 | shakivali123@gmail.com |
	|  7 | Kadir      | Safi      | Pakbada       | Delhi     | Delhi         |  22392 |      9837344 | kadir123@gmail.com     |
	+----+------------+-----------+---------------+-----------+---------------+--------+--------------+------------------------+
	3 rows in set (0.03 sec)

UC6:Ability to Retrieve Person belonging to a City or State from the Address Book.
Solution:
	//Retrieve a data belonging a particular field like City or State.
	mysql> SELECT * FROM address_book WHERE city="Ghaziabad" AND state="Uttar Pradesh";
	+----+------------+-----------+---------------+-----------+---------------+--------+--------------+---------------------+
	| id | first_name | last_name | address       | city      | state         | zip    | phone_number | email               |
	+----+------------+-----------+---------------+-----------+---------------+--------+--------------+---------------------+
	|  5 | Sameer     | Kassar    | Kailla Bhatta | Ghaziabad | Uttar Pradesh | 201001 |    997185839 | sk3090019@gmail.com |
	+----+------------+-----------+---------------+-----------+---------------+--------+--------------+---------------------+
	1 row in set (0.00 sec)




