************Welcome to Address Book System************

UC1:Ability to create a Address Book Service DB.
Solution:
	//Create a database using 'CREATE'command like:address_book_system.
	mysql> CREATE DATABASE address_book_system;
	Query OK, 1 row affected (0.17 sec)
	
	//View a all databases.
	mysql> SHOW databases;
	+---------------------+
	| Database            |
	+---------------------+
	| address_book_system |
	| information_schema  |
	| mysql               |
	| payroll_service     |
	| performance_schema  |
	| sakila              |
	| sys                 |
	| world               |
	+---------------------+
	8 rows in set (0.00 sec)

	//Use particular database using 'USE' command. 
	mysql> USE address_book_system;
	Database changed

	//View database.
	mysql> SELECT DATABASE();
	+---------------------+
	| DATABASE()          |
	+---------------------+
	| address_book_system |
	+---------------------+
	1 row in set (0.00 sec)

UC2:Create a Address Book Table with first and last names, address, city, state, zip, phone number and email as its attributes.
Solution:
	//Create a table using 'CREATE' command.
	mysql> CREATE TABLE address_book
    	-> (
    	-> id               INT unsigned NOT NULL AUTO_INCREMENT,	#Unique ID for the record.
    	-> first_name       VARCHAR(50) NOT NULL,			#First Names of Address Book.
    	-> last_name        VARCHAR(50),				#Last Names of Address Book.
    	-> address          VARCHAR(150) NOT NULL,			#Address of Address Book.
    	-> city             VARCHAR(30) NOT NULL,			#City of Address Book.
    	-> state            VARCHAR(30) NOT NULL,			#State of Address Book.
    	-> zip              INT(6) NOT NULL,				#Zip of Address Book.
    	-> phone_number     INT(13) NOT NULL,				#Phone number of Addess Book.
    	-> email            VARCHAR(50) NOT NULL,			#Email of Address Book.
    	-> PRIMARY KEY(id)						#Make id primary key.
    	-> );
	Query OK, 0 rows affected, 2 warnings (1.25 sec)

	//View the table using 'DESCRIBE'command.
	mysql> DESCRIBE address_book;
	+--------------+--------------+------+-----+---------+----------------+
	| Field        | Type         | Null | Key | Default | Extra          |
	+--------------+--------------+------+-----+---------+----------------+
	| id           | int unsigned | NO   | PRI | NULL    | auto_increment |
	| first_name   | varchar(50)  | NO   |     | NULL    |                |
	| last_name    | varchar(50)  | YES  |     | NULL    |                |
	| address      | varchar(150) | NO   |     | NULL    |                |
	| city         | varchar(30)  | NO   |     | NULL    |                |
	| state        | varchar(30)  | NO   |     | NULL    |                |
	| zip          | int          | NO   |     | NULL    |                |
	| phone_number | int          | NO   |     | NULL    |                |
	| email        | varchar(50)  | NO   |     | NULL    |                |
	+--------------+--------------+------+-----+---------+----------------+
	9 rows in set (0.03 sec)


UC3:Ability to insert new Contacts to Address Book.
Solution:
	//Insert a data into table using 'INSERT' command.
	mysql> INSERT INTO address_book(first_name, last_name, address, city , state , zip , phone_number, email) VALUES
    	-> ('Sameer','Kassar','Kailla Bhatta','Ghaziabad','Uttar Pradesh',201001,997185839,'sk3090019@gmail.com'),
    	-> ('Shakiv','Saifi','Milak','Rampur','UP',44401,97162777,'shakivali123@gmail.com'),
    	-> ('Kadir','Safi','Pakbada','Muradabad','Delhi',22392,9837344,'kadir123@gmail.com'),
    	-> ('Uwesh','Saifi','Bago Wali gali','Muzafarnagar','Delhi',66335,87647275,'uwesh123@gmail.com');
	Query OK, 4 rows affected (0.15 sec)
	Records: 4  Duplicates: 0  Warnings: 0

	//View a table in a table.
	mysql> SELECT * FROM address_book;
	+----+------------+-----------+----------------+--------------+---------------+--------+--------------+------------------------+
	| id | first_name | last_name | address        | city         | state         | zip    | phone_number | email                  |
	+----+------------+-----------+----------------+--------------+---------------+--------+--------------+------------------------+
	|  5 | Sameer     | Kassar    | Kailla Bhatta  | Ghaziabad    | Uttar Pradesh | 201001 |    997185839 | sk3090019@gmail.com    |
	|  6 | Shakiv     | Saifi     | Milak          | Rampur       | UP            |  44401 |     97162777 | shakivali123@gmail.com |
	|  7 | Kadir      | Safi      | Pakbada        | Muradabad    | Delhi         |  22392 |      9837344 | kadir123@gmail.com     |
	|  8 | Uwesh      | Saifi     | Bago Wali gali | Muzafarnagar | Delhi         |  66335 |     87647275 | uwesh123@gmail.com     |
	+----+------------+-----------+----------------+--------------+---------------+--------+--------------+------------------------+
	4 rows in set (0.00 sec)
	

UC4: Ability to edit existing contact person using their name.
Solution:
	//Edit exixting contact using there name using 'UPDATE'comand.
	mysql> UPDATE address_book set city = 'Delhi' WHERE first_name = 'Kadir';
	Query OK, 1 row affected (0.08 sec)
	Rows matched: 1  Changed: 1  Warnings: 0

	//View a data table.
	mysql> SELECT * FROM address_book;
	+----+------------+-----------+----------------+--------------+---------------+--------+--------------+------------------------+
	| id | first_name | last_name | address        | city         | state         | zip    | phone_number | email                  |
	+----+------------+-----------+----------------+--------------+---------------+--------+--------------+------------------------+
	|  5 | Sameer     | Kassar    | Kailla Bhatta  | Ghaziabad    | Uttar Pradesh | 201001 |    997185839 | sk3090019@gmail.com    |
	|  6 | Shakiv     | Saifi     | Milak          | Rampur       | UP            |  44401 |     97162777 | shakivali123@gmail.com |
	|  7 | Kadir      | Safi      | Pakbada        | Delhi        | Delhi         |  22392 |      9837344 | kadir123@gmail.com     |
	|  8 | Uwesh      | Saifi     | Bago Wali gali | Muzafarnagar | Delhi         |  66335 |     87647275 | uwesh123@gmail.com     |
	+----+------------+-----------+----------------+--------------+---------------+--------+--------------+------------------------+
	4 rows in set (0.03 sec)

UC5:Ability to delete a person using person's name.
Solution:
	//Delate a feild using person name like:Uwesh.
	mysql> DELETE FROM address_book WHERE first_name = 'Uwesh';
	Query OK, 1 row affected (0.06 sec)

	//View a data table.
	mysql> SELECT * FROM address_book;
	+----+------------+-----------+---------------+-----------+---------------+--------+--------------+------------------------+
	| id | first_name | last_name | address       | city      | state         | zip    | phone_number | email                  |
	+----+------------+-----------+---------------+-----------+---------------+--------+--------------+------------------------+
	|  5 | Sameer     | Kassar    | Kailla Bhatta | Ghaziabad | Uttar Pradesh | 201001 |    997185839 | sk3090019@gmail.com    |
	|  6 | Shakiv     | Saifi     | Milak         | Rampur    | UP            |  44401 |     97162777 | shakivali123@gmail.com |
	|  7 | Kadir      | Safi      | Pakbada       | Delhi     | Delhi         |  22392 |      9837344 | kadir123@gmail.com     |
	+----+------------+-----------+---------------+-----------+---------------+--------+--------------+------------------------+
	3 rows in set (0.03 sec)

UC6:Ability to Retrieve Person belonging to a City or State from the Address Book.
Solution:
	//Retrieve a data belonging a particular field like City or State.
	mysql> SELECT * FROM address_book WHERE city="Ghaziabad" AND state="Uttar Pradesh";
	+----+------------+-----------+---------------+-----------+---------------+--------+--------------+---------------------+
	| id | first_name | last_name | address       | city      | state         | zip    | phone_number | email               |
	+----+------------+-----------+---------------+-----------+---------------+--------+--------------+---------------------+
	|  5 | Sameer     | Kassar    | Kailla Bhatta | Ghaziabad | Uttar Pradesh | 201001 |    997185839 | sk3090019@gmail.com |
	+----+------------+-----------+---------------+-----------+---------------+--------+--------------+---------------------+
	1 row in set (0.00 sec)

UC7:Ability to understand the size of address book by City and State -Here size indicates the count.
Solution:
	//Count the number of person in a particular city.
	mysql> SELECT city, COUNT(first_name) FROM address_book GROUP BY city;
	+-----------+-------------------+
	| city      | COUNT(first_name) |
	+-----------+-------------------+
	| Ghaziabad |                 1 |
	| Rampur    |                 1 |
	| Delhi     |                 1 |
	+-----------+-------------------+
	3 rows in set (0.00 sec)
	
	//Count the number of person in a particular state.
	mysql> SELECT state, COUNT(first_name) FROM address_book GROUP BY state;
	+---------------+-------------------+
	| state         | COUNT(first_name) |
	+---------------+-------------------+
	| Uttar Pradesh |                 1 |
	| UP            |                 1 |
	| Delhi         |                 1 |
	+---------------+-------------------+
	3 rows in set (0.03 sec)


UC8:Ability to retrieve entries sorted alphabetically by Person’s name for a given city.
Solution:
	//Insert some data are same in a particular field like:City-Ghaziabad.
	mysql> INSERT INTO address_book(first_name, last_name, address, city , state , zip , phone_number, email) VALUES
   	 -> ('Anas','Khan','Raj nagar','Ghaziabad','Uttar Pradesh',201009,99877473,'anas12@gmail.com');
	Query OK, 1 row affected (0.10 sec)
	
	//View data table.
	mysql> SELECT * FROM address_book;
	+----+------------+-----------+---------------+-----------+---------------+--------+--------------+------------------------+
	| id | first_name | last_name | address       | city      | state         | zip    | phone_number | email                  |
	+----+------------+-----------+---------------+-----------+---------------+--------+--------------+------------------------+
	|  5 | Sameer     | Kassar    | Kailla Bhatta | Ghaziabad | Uttar Pradesh | 201001 |    997185839 | sk3090019@gmail.com    |
	|  6 | Shakiv     | Saifi     | Milak         | Rampur    | UP            |  44401 |     97162777 | shakivali123@gmail.com |
	|  7 | Kadir      | Safi      | Pakbada       | Delhi     | Delhi         |  22392 |      9837344 | kadir123@gmail.com     |
	|  9 | Anas       | Khan      | Raj nagar     | Ghaziabad | Uttar Pradesh | 201009 |     99877473 | anas12@gmail.com       |
	+----+------------+-----------+---------------+-----------+---------------+--------+--------------+------------------------+
	4 rows in set (0.00 sec)

	//Sorted entries by assending order using 'ASC' command.
	mysql> SELECT * FROM address_book WHERE city='Ghaziabad' ORDER BY first_name ASC;
	+----+------------+-----------+---------------+-----------+---------------+--------+--------------+---------------------+
	| id | first_name | last_name | address       | city      | state         | zip    | phone_number | email               |
	+----+------------+-----------+---------------+-----------+---------------+--------+--------------+---------------------+
	|  9 | Anas       | Khan      | Raj nagar     | Ghaziabad | Uttar Pradesh | 201009 |     99877473 | anas12@gmail.com    |
	|  5 | Sameer     | Kassar    | Kailla Bhatta | Ghaziabad | Uttar Pradesh | 201001 |    997185839 | sk3090019@gmail.com |
	+----+------------+-----------+---------------+-----------+---------------+--------+--------------+---------------------+
	2 rows in set (0.00 sec)


UC9:Ability to identify each Address Book with name and Type.
Solution:
	//Add one field in a table like:type.
	mysql> ALTER table address_book add type varchar(50);
	Query OK, 0 rows affected (0.84 sec)
	Records: 0  Duplicates: 0  Warnings: 0
	
	//View Table in a display.
	mysql> SELECT * FROM address_book;
	+----+------------+-----------+---------------+-----------+---------------+--------+--------------+------------------------+------+
	| id | first_name | last_name | address       | city      | state         | zip    | phone_number | email                  | type |
	+----+------------+-----------+---------------+-----------+---------------+--------+--------------+------------------------+------+
	|  5 | Sameer     | Kassar    | Kailla Bhatta | Ghaziabad | Uttar Pradesh | 201001 |    997185839 | sk3090019@gmail.com    | NULL |
	|  6 | Shakiv     | Saifi     | Milak         | Rampur    | UP            |  44401 |     97162777 | shakivali123@gmail.com | NULL |
	|  7 | Kadir      | Safi      | Pakbada       | Delhi     | Delhi         |  22392 |      9837344 | kadir123@gmail.com     | NULL |
	|  9 | Anas       | Khan      | Raj nagar     | Ghaziabad | Uttar Pradesh | 201009 |     99877473 | anas12@gmail.com       | NULL |
	+----+------------+-----------+---------------+-----------+---------------+--------+--------------+------------------------+------+
	4 rows in set (0.03 sec)
	
	//Add a type like family.
	mysql> UPDATE address_book SET type="family" WHERE first_name="Sameer";
	Query OK, 1 row affected (0.13 sec)
	Rows matched: 1  Changed: 1  Warnings: 0
	
	//Add a type like:friend.
	mysql> UPDATE address_book SET type="friend" WHERE first_name="Shakiv";
	Query OK, 1 row affected (0.08 sec)
	Rows matched: 1  Changed: 1  Warnings: 0

	//Add a type like:family
	mysql> UPDATE address_book SET type="family" WHERE first_name="Kadir";
	Query OK, 1 row affected (0.10 sec)
	Rows matched: 1  Changed: 1  Warnings: 0
	
	//Add a type like:profession
	mysql> UPDATE address_book SET type="Profession" WHERE first_name="Anas";
	Query OK, 1 row affected (0.11 sec)
	Rows matched: 1  Changed: 1  Warnings: 0

	//View a data table.
	mysql> SELECT * FROM address_book;
	+----+------------+-----------+---------------+-----------+---------------+--------+--------------+------------------------+------------+
	| id | first_name | last_name | address       | city      | state         | zip    | phone_number | email                  | type       |
	+----+------------+-----------+---------------+-----------+---------------+--------+--------------+------------------------+------------+
	|  5 | Sameer     | Kassar    | Kailla Bhatta | Ghaziabad | Uttar Pradesh | 201001 |    997185839 | sk3090019@gmail.com    | family     |
	|  6 | Shakiv     | Saifi     | Milak         | Rampur    | UP            |  44401 |     97162777 | shakivali123@gmail.com | friend     |
	|  7 | Kadir      | Safi      | Pakbada       | Delhi     | Delhi         |  22392 |      9837344 | kadir123@gmail.com     | family     |
	|  9 | Anas       | Khan      | Raj nagar     | Ghaziabad | Uttar Pradesh | 201009 |     99877473 | anas12@gmail.com       | Profession |
	+----+------------+-----------+---------------+-----------+---------------+--------+--------------+------------------------+------------+
	4 rows in set (0.00 sec)

UC10:Ability to get number of contact persons i.e. count by type.
Solution:
	//Count by types
	mysql> SELECT first_name,type,COUNT(type) FROM address_book GROUP BY first_name;
	+------------+------------+-------------+
	| first_name | type       | COUNT(type) |
	+------------+------------+-------------+
	| Sameer     | family     |           1 |
	| Shakiv     | friend     |           1 |
	| Kadir      | family     |           1 |
	| Anas       | Profession |           1 |
	+------------+------------+-------------+
	4 rows in set (0.00 sec)
